user_input,reference_contexts,reference,synthesizer_name
How does Keanu Reeves contribute to the success of the film John Wick?,"["": 0\nReview: The best way I can describe John Wick is to picture Taken but instead of Liam Neeson it's Keanu Reeves and instead of his daughter it's his dog. That's essentially the plot of the movie. John Wick (Reeves) is out to seek revenge on the people who took something he loved from him. It's a beautifully simple premise for an action movie - when action movies get convoluted, they get bad i.e. A Good Day to Die Hard. John Wick gives the viewers what they want: Awesome action, stylish stunts, kinetic chaos, and a relatable hero to tie it all together. John Wick succeeds in its simplicity.""]","Keanu Reeves contributes to the success of John Wick by portraying a relatable hero who seeks revenge for the loss of something he loved, which is central to the film's beautifully simple premise. His performance ties together the awesome action, stylish stunts, and kinetic chaos that the movie delivers.",single_hop_specifc_query_synthesizer
Wut makes Jon Wick a must-see for action movie fans?,"[': 2\nReview: With the fourth installment scoring immensely at the cinemas as I\'m submitting this review, and after three previous films that are apparently loved by everyone else in the world, I thought perhaps it would be time for me check out ""John Wick"".']","The fourth installment of John Wick is scoring immensely at the cinemas, and the previous three films are apparently loved by everyone else in the world, making it a standout series for action movie fans.",single_hop_specifc_query_synthesizer
"Wht makes Jon Wick stand out among action films, despite its simpl revenge plot?","[': 3\nReview: John wick has a very simple revenge story. It can be summarized as ""Keanu gets angry and shoots bad guys"" but what makes it special? Directed by Chad Stahelski who\'s a stunt specialist boy does it show because the main selling point in the film are some real virtuoso action sequences, well made choreographies. Unlike today\'s action movies, it doesn\'t use quick-cuts or shaky cameras actually see what\'s going on.']","John Wick stands out due to its virtuoso action sequences and well-made choreographies, directed by Chad Stahelski, a stunt specialist. Unlike today's action movies, it avoids quick-cuts or shaky cameras, allowing viewers to actually see what's going on.",single_hop_specifc_query_synthesizer
What role do Russian mobsters play in the movie John Wick?,"[': 4\nReview: Though he no longer has a taste for wet work, retired assassin and ""Boogeyman"" John Wick has suffered a personal tragedy that\'s left a huge void in his life. When he and his dog (really the last meaningful thing he has left) fall victim to a scummy group of Russian mobsters, he emerges from his shell with vengeance on his mind. Slow and ambiguous at first, but reveals more as it goes along, and once it kicks into gear it rarely lets up with plenty of stylized, visceral action scenes, an impressive arsenal of weaponry, plus sly direction and editing that give it the feel of a violent music video at times. Preposterously fun to watch, it just doesn\'t have much of a story at its disposal, not to mention all the over-the-top bloodletting and mayhem eventually becomes redundant. Savvy, indestructible Reeves looks right at home, and delivers many of his lines with a sardonic wit. **½']","In the movie John Wick, Russian mobsters are responsible for attacking John Wick and his dog, which prompts him to seek vengeance.",single_hop_specifc_query_synthesizer
Wut role duz the Russian mob play in John Wick?,"["": 5\nReview: Ultra-violent first entry with lots of killings, thrills , noisy action , suspense , and crossfire . In this original John Wick (2014) , an ex-hit-man comes out of retirement to track down the gangsters that killed his dog and took everything from him . With the untimely death of his beloved wife still bitter in his mouth he seeks for vengeance . But when an arrogant Russian mob prince and hoodlums steal his car and kill his dog , they are fully aware of his lethal capacity. The Bogeyman will find himself dragged into an impossible task as every killer in the business dreams of cornering the legendary Wick who now has an enormous price on his head . In this first installment John Wick , blind with revenge, and for his salvation John will immediately unleash a carefully orchestrated maelstrom of destruction against those attempt to chase him and with a price tag on his head, as he is the target of hit men : an army of bounty-hunting killers on his trail and a murderer woman everywhere . The legendary hitman will be forced to unearth his meticulously concealed identity and to carry out a relentless vendetta . Now, only blood can quench the boogeyman's thirst for retribution . Don't Set Him Off! . John Wick isn't the Boogeyman... He's the guy you send to kill the doomed Boogeyman. Revenge is all he has left. You want peace, prepare for war . Don't Hunt What You Can't Kill. Tick Tock, Mr. Wick. Everyone Is Waiting. For John Wick . Every Action Has Consequences. This Friday, Wick is Back . Its the World Vs. Wick. Every Action Has Consequences.""]","In the original John Wick (2014), an arrogant Russian mob prince and hoodlums steal John Wick's car and kill his dog, which prompts him to come out of retirement and seek vengeance.",single_hop_specifc_query_synthesizer
What role does Ian McShane play in the film 'John Wick' and how does his performance contribute to the movie's overall appeal?,"[""<1-hop>\n\n: 9\nReview: At first glance, John Wick sounds like a terrible film on paper but with the slickness of Keanu Reeves' performance as the titular character and the sheer brilliance in its action sequences, this marks the best action film of the year and one of the absolute best in the past decade. Following a brutal home invasion that leaves his beloved dog murdered by thugs from his past, John Wick vows revenge on the ones who have taken what he loves most. Like I said, on paper, this seems like a direct-to-DVD slopfest starring John Cena but as a film with Keanu Reeves as the lead, it marks the very welcomed return for Reeves to the genre. John Wick is insanely fun, violently brutal and an overall romp especially for those disappointed by The Expendables 3. John Wick is propelled by Tarantino-esque dialog mixed with the swagger of action stars from the 70s. Reeves literally emulates cool in this film and does it with such confidence, that we don't even doubt the character...even when he kills countless bad guys with extreme force in some utterly ridiculous and implausible situations. We don't doubt it for a minute. This is EXACTLY what you want out of an action film. It is briskly paced, brilliantly shot and meticulously choreographed and keeps you wanting more and more. The supporting cast filled with the likes of John Legiuzamo, Ian McShane, and Willen Dafoe also keeps this film very interesting. These guys don't play good guys, hell, John Wick by traditional standards would be a bad guy in any other film. Every character is more ruthless than the next and pushes John Wick to be more ruthless than they are, creating a very cool dynamic between the character and the plot regarding the idea of how far is too far? However, don't expect some revelation from John Wick regarding the morality of bad and evil. This film wants you entertained and does so with brute force, it never lets up, not even for a second. One scene in particular that will have your blood pumping is a showdown between thugs and Wick in a nightclub. This action sequence remains the best in the film and will have you grasping your theater seat because of the sheer intensity of it. Overall, John Wick is slick, violent fun that turns into a remarkable, surprising film that will catch you off guard. It is THAT good. I highly recommend this film to action buffs especially but I'm sure those who just like a good movie will love it as well."", ""<2-hop>\n\n: 20\nReview: John Wick is something special. It takes as much time setting up elaborate action sequences as it does the world with which it all takes place in. And what a world it is. It reminds me of Millers Crossing and it is cooler than any other recent attempt at noir. We are shown a criminal underworld where, if you are connected, many powerful people know who you are and show you respect. John Wick was connected but he got out. He is the rare killer who has found peace, and he is grateful for that peace. Some young kids steal that from him and he does what he does best, he wages a one man war against the Russian Mafia. It might sound like the film takes quite a leap but it all makes sense. The motives of John and the people who get in the way of his bullets are all very clear, even if it does come across as rather simple. That's the plot at it's most basic. Then there's the action. The film is directed by Reeve's stuntman from The Matrix, so this guy knows action. There are sequences that flow so smoothly it puts other action films and their quick cuts to shame. Keaunu moves so fluidly throughout the film and comes across as such a natural that the only disappointment is that we have not seen him like this before. Along the way are plenty of character actors, fans of The Matrix and The Wire will recognize a few people then there are more obvious ones like Ian McShane and Willem Dafoe. Everyone seems to be having a good time. That is another plus for this movie. It get's dark at times but overall it is quite fun, not very chipper, but fun. I cannot recommend this movie enough. I believe it is a must see for action fans and for anyone looking for something a bit different from the usual fare.""]","In the film 'John Wick', Ian McShane plays a supporting role that adds depth to the movie's portrayal of a criminal underworld. His character is part of a cast that includes other notable actors like John Leguizamo and Willem Dafoe, contributing to the film's dynamic and ruthless atmosphere. McShane's performance, along with the rest of the supporting cast, keeps the film interesting and enhances the cool dynamic between the characters and the plot. This, in turn, helps to create a world that is both engaging and entertaining, making 'John Wick' a standout action film that is highly recommended for its slick, violent fun and remarkable execution.",multi_hop_specific_query_synthesizer
How does John Wick: Chapter 4 compare to its predecessors in terms of action sequences and overall reception?,"[""<1-hop>\n\n: 22\nReview: HORRIBLE movie. I love John Wick. I mean I wouldn't pay to see one, but I love the series none the less. Even liked the third one even though the ending blew baby chunks. All the 10s and 9s scores are so damn fake it's hilarious. IMDB is a joke. Someone needs to start a real movie database and weed out the fake high scores, it's as ridiculous as John Wick 4. He walks away from every major injury or collision or building fall. Then he passes away from flesh wounds. What nonsense. The whole plot is nonsense. The fights scene are so boring. I got up to make a sandwich twice. Just the typical 100 judo throws and same shots to head. Numerous coup de grace's. I feel sorry for anyone who paid for this nonsense."", ""<2-hop>\n\n: 19\nReview: John Wick: Chapter 4 picks up where Chapter 3: Parabellum left off. As has been the tradition in the sequels to this beloved martial arts action franchise the action starts from the very inception of the film's opening, and lasts until the curtain falls. JW4 is no exception to that rule. What it does do is improve on the prior installment, and solidify Keanu Reeves as the greatest martial arts action star of all time. If you don't accept that notion, then you must accept the fact that it solidifies Reeves and Director, Chad Stahelski, as the greatest martial arts action pairing of modern times.""]","John Wick: Chapter 4 continues the tradition of intense action sequences from the very beginning to the end, as established in the previous films of the franchise. It is noted for improving on the prior installment, Chapter 3: Parabellum, and solidifying Keanu Reeves as a top martial arts action star. However, opinions on the film are divided, with some viewers criticizing the plot and action scenes as nonsensical and repetitive, while others praise the film for its relentless entertainment and the successful collaboration between Reeves and Director Chad Stahelski.",multi_hop_specific_query_synthesizer
What are the critical reviews and audience expectations for John Wick 2 and John Wick 3?,"[""<1-hop>\n\n: 16\nReview: Ok, so I got back from seeing this entry yesterday night. I'm writing this review in the early hours after midnight as the film went on for a good whopping 2 hours & 39 minutes!! But we'll get to that in a bit...! Anyway, I was looking forward to this film since John Wick 3's release back in 2019 & this film has had a bit of a troubled history of getting pushed back until it finally got its March 2023 release. I must admit I was a bit skeptical, but, was looking forward to this as the John Wick films are ace, but this film was a bitter disappointment...!"", ""<2-hop>\n\n: 10\nReview: The first John Wick film took me by surprise; it was a cartoonish action film that was surprisingly brutal in its content, cruel in its delivery, and had a real punch to it. All of it existed inside a world that convinced in its own logic, even if it was clearly fantasy. John Wick 2 doesn't have the ability to sneak up on me unannounced, which does work against it, but this is not what hurts it the most.""]","The critical review for John Wick 2 highlights that the film, while unable to surprise audiences as the first film did, suffers from not being able to sneak up unannounced, which works against it. However, it maintains the cartoonish action and brutal content that defined the original. In contrast, the anticipation for John Wick 3 was high following its 2019 release, but the subsequent film, released in March 2023, was met with disappointment. Despite the high expectations set by the previous films, the latest installment was considered a bitter disappointment by some, possibly due to its extended runtime and troubled production history.",multi_hop_specific_query_synthesizer
What are the contrasting elements in the reviews of 'John Wick: Chapter 3 - Parabellum' regarding its genre classification and entertainment value?,"['<1-hop>\n\n: 21\nReview: ..THE FILM-MAKERS, { VERY SIGNIFICANTLY }, HAVE FORGOTTEN TO ADD { "" F A N T A S Y "" }, TO THEIR LITTLE LIST OF GENRES APPLICABLE TO ""JOHN WICK, CHAPTER 3 : PARABELLUM"" .', ""<2-hop>\n\n: 13\nReview: Following on from two deliriously entertaining, visually gorgeous and blissfully simplistic thrillers, John Wick: Chapter 3 - Parabellum keeps up the franchise's unique appeal in stunning fashion. Complete with electrifying action, beautiful cinematography, a pulsating score and a great sense of humour, the film is pretty much as purely joyful as action thrillers get, and proves two hours of brilliant entertainment.""]","The reviews of 'John Wick: Chapter 3 - Parabellum' present contrasting elements regarding its genre classification and entertainment value. One review criticizes the filmmakers for neglecting to include 'fantasy' in the list of applicable genres, suggesting a potential oversight in capturing the film's full thematic scope. In contrast, another review praises the film for maintaining the franchise's unique appeal with electrifying action, beautiful cinematography, a pulsating score, and a great sense of humour, highlighting it as a source of pure joy and brilliant entertainment.",multi_hop_specific_query_synthesizer
Why John Wick 2 not surprise like first JOHN WICK?,"[""<1-hop>\n\n: 10\nReview: The first John Wick film took me by surprise; it was a cartoonish action film that was surprisingly brutal in its content, cruel in its delivery, and had a real punch to it. All of it existed inside a world that convinced in its own logic, even if it was clearly fantasy. John Wick 2 doesn't have the ability to sneak up on me unannounced, which does work against it, but this is not what hurts it the most."", ""<2-hop>\n\n: 11\nReview: JOHN WICK is a rare example of Hollywood getting things spot-on when it comes to creating the near-perfect action film. JOHN WICK is a relentless, pulse-pounding thriller that has plenty of similarity to the Liam Neeson classic TAKEN, albeit with a more simplistic (and also more emotionally intense) plot line. This is the kind of lean, pared-down film-making that's all about intensity and momentum. It sits well with classic international fare like POINT BLANK, SLEEPLESS NIGHT, MEA CULPA, THE MAN FROM NOWHERE, and THE RAID films.""]","The first John Wick film was surprising because it was a cartoonish action film that was brutal and cruel, existing in a convincing fantasy world. John Wick 2, however, couldn't sneak up unannounced like the first film, which worked against it.",multi_hop_specific_query_synthesizer
